{
  "id": "karriko_ausbildung",
  "version": 1,
  "locale": "de-DE",
  "phases": [
    {
      "id": "steuerung",
      "label": {
        "current": "Vorab",
        "past": "Vorab"
      },
      "estimatedSeconds": 45
    },
    {
      "id": "kern",
      "label": {
        "current": "Deine Ausbildung",
        "past": "Deine Ausbildung"
      },
      "estimatedSeconds": 150
    },
    {
      "id": "vertiefung",
      "label": {
        "current": "Vertiefung",
        "past": "Vertiefung"
      },
      "holdsModules": true
    },
    {
      "id": "abschluss",
      "label": {
        "current": "Abschluss",
        "past": "Abschluss"
      },
      "estimatedSeconds": 90
    }
  ],
  "flow": {
    "tenseQuestion": "s1_status",
    "pastValues": [
      "ausgelernt_geblieben",
      "ausgelernt_gegangen",
      "abgebrochen"
    ],
    "priorityQuestion": "k12_prioritaeten",
    "priorityTopN": 3,
    "secondsPerQuestion": 10
  },
  "questions": [
    {
      "id": "intro_anonymitaet",
      "specRef": "Abschnitt 1",
      "type": "anonymity_notice",
      "phase": "steuerung",
      "text": {
        "current": "Bevor es losgeht",
        "past": "Bevor es losgeht"
      },
      "config": {
        "textKey": "anonymity.intro"
      },
      "review": true
    },
    {
      "id": "s1_status",
      "specRef": "S1",
      "type": "single_choice_tiles",
      "phase": "steuerung",
      "required": true,
      "text": {
        "current": "Wo stehst du gerade?",
        "past": "Wo stehst du gerade?"
      },
      "options": [
        {
          "id": "in_ausbildung",
          "label": {
            "current": "Ich bin noch in der Ausbildung",
            "past": "Ich bin noch in der Ausbildung"
          }
        },
        {
          "id": "ausgelernt_geblieben",
          "label": {
            "current": "Ich habe dort ausgelernt und bin geblieben",
            "past": "Ich habe dort ausgelernt und bin geblieben"
          }
        },
        {
          "id": "ausgelernt_gegangen",
          "label": {
            "current": "Ich habe dort ausgelernt und bin gegangen",
            "past": "Ich habe dort ausgelernt und bin gegangen"
          }
        },
        {
          "id": "abgebrochen",
          "label": {
            "current": "Ich habe die Ausbildung dort vorzeitig beendet",
            "past": "Ich habe die Ausbildung dort vorzeitig beendet"
          }
        }
      ]
    },
    {
      "id": "s2_startjahr",
      "specRef": "S2",
      "type": "dropdown",
      "phase": "steuerung",
      "required": true,
      "public": true,
      "text": {
        "current": "Wann hast du dort angefangen?",
        "past": "Wann hast du dort angefangen?"
      },
      "config": {
        "min": 2005,
        "max": 2026,
        "step": 1,
        "kind": "year",
        "publicField": "start_year"
      },
      "review": true
    },
    {
      "id": "s2_1_endjahr",
      "specRef": "S2",
      "type": "dropdown",
      "phase": "steuerung",
      "public": true,
      "text": {
        "current": "Wann hast du aufgehört?",
        "past": "Wann hast du aufgehört?"
      },
      "condition": {
        "all": [
          {
            "answered": {
              "answer": "s1_status"
            }
          },
          {
            "neq": [
              {
                "answer": "s1_status"
              },
              "in_ausbildung"
            ]
          }
        ]
      },
      "config": {
        "min": 2005,
        "max": 2026,
        "step": 1,
        "kind": "year",
        "publicField": "end_year"
      },
      "review": true
    },
    {
      "id": "s3_beruf",
      "specRef": "S3",
      "type": "search_select",
      "phase": "steuerung",
      "required": true,
      "public": true,
      "text": {
        "current": "Welchen Beruf lernst du dort?",
        "past": "Welchen Beruf hast du dort gelernt?"
      },
      "config": {
        "source": "berufe",
        "asset": "assets/data/berufe_beispiel.json",
        "maxLength": 200,
        "publicField": "beruf_name"
      },
      "review": true
    },
    {
      "id": "s4_lehrjahr",
      "specRef": "S4",
      "type": "segmented",
      "phase": "steuerung",
      "text": {
        "current": "In welchem Ausbildungsjahr bist du?",
        "past": "In welchem Ausbildungsjahr hast du aufgehört?"
      },
      "condition": {
        "in": [
          {
            "answer": "s1_status"
          },
          [
            "in_ausbildung",
            "abgebrochen"
          ]
        ]
      },
      "options": [
        {
          "id": "probezeit",
          "label": {
            "current": "Probezeit",
            "past": "Probezeit"
          }
        },
        {
          "id": "jahr_1",
          "label": {
            "current": "1.",
            "past": "1."
          }
        },
        {
          "id": "jahr_2",
          "label": {
            "current": "2.",
            "past": "2."
          }
        },
        {
          "id": "jahr_3",
          "label": {
            "current": "3.",
            "past": "3."
          }
        },
        {
          "id": "jahr_4",
          "label": {
            "current": "4.",
            "past": "4."
          }
        }
      ],
      "review": true
    },
    {
      "id": "s5_betriebsgroesse",
      "specRef": "S5",
      "type": "single_choice_tiles",
      "phase": "steuerung",
      "text": {
        "current": "Wie groß ist der Betrieb ungefähr?",
        "past": "Wie groß war der Betrieb ungefähr?"
      },
      "options": [
        {
          "id": "unter_10",
          "label": {
            "current": "unter 10",
            "past": "unter 10"
          }
        },
        {
          "id": "10_49",
          "label": {
            "current": "10 bis 49",
            "past": "10 bis 49"
          }
        },
        {
          "id": "50_249",
          "label": {
            "current": "50 bis 249",
            "past": "50 bis 249"
          }
        },
        {
          "id": "ab_250",
          "label": {
            "current": "250 und mehr",
            "past": "250 und mehr"
          }
        },
        {
          "id": "weiss_nicht",
          "label": {
            "current": "weiß ich nicht",
            "past": "weiß ich nicht"
          }
        }
      ]
    },
    {
      "id": "s6_azubizahl",
      "specRef": "S6",
      "type": "single_choice_tiles",
      "phase": "steuerung",
      "text": {
        "current": "Wie viele Azubis gibt es dort insgesamt?",
        "past": "Wie viele Azubis gab es dort insgesamt?"
      },
      "options": [
        {
          "id": "nur_ich",
          "label": {
            "current": "nur ich",
            "past": "nur ich"
          }
        },
        {
          "id": "2_5",
          "label": {
            "current": "2 bis 5",
            "past": "2 bis 5"
          }
        },
        {
          "id": "6_20",
          "label": {
            "current": "6 bis 20",
            "past": "6 bis 20"
          }
        },
        {
          "id": "mehr",
          "label": {
            "current": "mehr",
            "past": "mehr"
          }
        },
        {
          "id": "weiss_nicht",
          "label": {
            "current": "weiß ich nicht",
            "past": "weiß ich nicht"
          }
        }
      ]
    },
    {
      "id": "s7_ausbildungsform",
      "specRef": "S7",
      "type": "single_choice_tiles",
      "phase": "steuerung",
      "text": {
        "current": "Wie läuft deine Ausbildung?",
        "past": "Wie lief deine Ausbildung?"
      },
      "options": [
        {
          "id": "dual",
          "label": {
            "current": "klassisch dual",
            "past": "klassisch dual"
          }
        },
        {
          "id": "duales_studium",
          "label": {
            "current": "duales Studium",
            "past": "duales Studium"
          }
        },
        {
          "id": "teilzeit",
          "label": {
            "current": "Teilzeit",
            "past": "Teilzeit"
          }
        },
        {
          "id": "verbund",
          "label": {
            "current": "Verbundausbildung",
            "past": "Verbundausbildung"
          }
        }
      ]
    },
    {
      "id": "s8_arbeitsalltag",
      "specRef": "S8",
      "type": "swipe_binary",
      "phase": "steuerung",
      "text": {
        "current": "Was trifft auf deinen Arbeitsalltag zu?",
        "past": "Was traf auf deinen Arbeitsalltag zu?"
      },
      "config": {
        "yesValue": "ja",
        "noValue": "nein",
        "otherValues": [
          "weiss_nicht"
        ],
        "cards": [
          {
            "id": "schichtarbeit",
            "label": {
              "current": "Schichtarbeit",
              "past": "Schichtarbeit"
            }
          },
          {
            "id": "wochenenddienste",
            "label": {
              "current": "Wochenenddienste",
              "past": "Wochenenddienste"
            }
          },
          {
            "id": "montage",
            "label": {
              "current": "Montage oder Auswärtstätigkeit",
              "past": "Montage oder Auswärtstätigkeit"
            }
          },
          {
            "id": "kundenkontakt",
            "label": {
              "current": "direkter Kundenkontakt",
              "past": "direkter Kundenkontakt"
            }
          },
          {
            "id": "fahrerei",
            "label": {
              "current": "viel Fahrerei",
              "past": "viel Fahrerei"
            }
          },
          {
            "id": "koerperlich_schwer",
            "label": {
              "current": "körperlich schwere Arbeit",
              "past": "körperlich schwere Arbeit"
            }
          },
          {
            "id": "bildschirm",
            "label": {